{
  "$schema": "../../../config/schemas/reference-protocol.schema.json",
  "schemaVersion": "akm.eval.reference-protocol.v1",
  "id": "longmemeval-qwen35-9b-q4km-131k-v1-akm-0.9.15",
  "benchmark": {
    "id": "longmemeval",
    "datasetSource": "https://huggingface.co/datasets/xiaowu0162/longmemeval-cleaned/resolve/98d7416c24c778c2fee6e6f3006e7a073259d48f/longmemeval_s_cleaned.json",
    "datasetSha256": "d6f21ea9d60a0d56f34a05b609c79c88a451d2ae03597821ea3d5a9678c3a442",
    "questionCount": 500,
    "questionIdsSha256": "a4849b8afda6b6ed31ead4fc28d00784d2d5fef945be87642f5ce3ab710b21c4",
    "topK": 5,
    "promptContract": "longmemeval-v2",
    "promptProtocolSha256": "8ba824b9dc651ad28a9bd1a37209d954d5a96b36dceacfdc03ef3d39ab56a240"
  },
  "answerModel": {
    "requestedModel": "qwen3.5-9b",
    "resolvedModel": "qwen3.5-9b",
    "artifact": "Qwen3.5-9B-Q4_K_M.gguf",
    "artifactSource": "https://huggingface.co/lmstudio-community/Qwen3.5-9B-GGUF/resolve/d9006465af6fc714af653e381fbfa55ead5af84b/Qwen3.5-9B-Q4_K_M.gguf",
    "artifactBytes": 5627044256,
    "artifactSha256": "cd76ec205963b3b33350093e6904d9de16c4e666fd104e1f632d25c7f15f2a13",
    "quantization": "Q4_K_M",
    "runtimeImage": "mixed: CUDA ghcr.io/ggml-org/llama.cpp@sha256:e61f29b37c471f956a772f91f4e9952d29f237e5d1a1a748e14421aae090305f (b10818-4d9176092); Intel/SYCL ghcr.io/ggml-org/llama.cpp:server-intel@sha256:58b3ad3bcbd805ef4094b1daaed8c9df4db9fc02aded25727883d5ad512cabda (b10644-d7a207411)",
    "options": {
      "temperature": 0,
      "max_tokens": 256,
      "seed": 1337,
      "chat_template_kwargs": {
        "enable_thinking": false
      }
    }
  },
  "judge": {
    "requestedModel": "gpt-4o",
    "resolvedModel": "gpt-4o-2024-08-06",
    "temperature": 0,
    "maxTokens": 64,
    "maxUnparseableRate": 0.02,
    "scriptSha256": "5822a286ca6406b1c16567b6c281179a7594fdb8a2b88c2de214515ca5c0986a"
  },
  "akm": {
    "variant": "akm-memory-lead",
    "fragmentContext": {
      "mode": "lead",
      "maxChars": 3200
    }
  },
  "configuration": {
    "recordedPath": "results/reference/longmemeval-qwen35-9b-q4km-131k-v1/recorded-config.json",
    "recordedSha256": "1e7579d42b8f681941f1a47cde8da1c3e48fdfbc64449cf6df50f43b1b0f249e",
    "reproductionPath": "config/reference/longmemeval-qwen35-9b-q4km-131k-v1.json",
    "reproductionSha256": "14dc225ce0ae4b5d280d6e90d4b07017dd06506a5d49a1a2de51bf8ec80ddaf2"
  },
  "controls": ["baseline", "raw-vector"],
  "artifactManifest": "results/reference/longmemeval-qwen35-9b-q4km-131k-v1-akm-0.9.15/SHA256SUMS"
}
